{
  "org_id": "org-acme",
  "project_id": "proj-iplanic",
  "chain_id": "IPLAN-CHAIN-01",
  "title": "Phase rollout chain",
  "status": "Completed",
  "current_version_id": "chain-version-01HZ",
  "latest_version_id": "chain-version-01HZ",
  "record_version": 5,
  "owner": {
    "owner_id": "team-platform",
    "owner_type": "team"
  },
  "lifecycle": {
    "state": "Completed",
    "last_event_id": "lifecycle-2026-06-11-e7c2",
    "last_transition_at": "2026-06-11T18:00:00Z",
    "available_transitions": ["supersede", "abandon", "archive"]
  },
  "labels": ["phase-c", "chain"],
  "created_at": "2026-06-11T16:00:02Z",
  "updated_at": "2026-06-11T18:00:00Z"
}
